ID,Adresse,Beschreibung,Nummer,Auch mit Gebühr,created,likes,Status,status_reason,position
1134,"Naunynstraße 60, 10997 Berlin","An der Ecke gibts Trinkteufel, eine sehr populare Kneipe und viele Leute kommen mit Fahrrader aber gibts keine Moglichkeit die abzuschliessen.",2,False,2019-10-04T08:23:38+00:00,,report_verification,,"52.5021707416631,13.4201114800796"
1135,"Prinzenstraße 113, 10969 Berlin",Es werden mehr Fahrradständer für die Freibadbesucher benötigt.,12,False,2019-10-04T09:11:47+00:00,,report_verification,,"52.4978684688151,13.4060698904568"
1136,"Friedrichstraße 41, 10969 Berlin",Am U-Bhf Kochstraße stehen viel zu wenig Fahrradbügel.,12,False,2019-10-04T09:45:05+00:00,,report_verification,,"52.5064035290106,13.3905779290386"
1137,"Gärtnerstraße 7, 10245 Berlin",Um den Boxhagener Platz gibt es generell zu wenig Fahrradbügel. Konkret gibt es für die Bewohner der Gärtnerstr. 7 im Hof nur 4 Bügel für 28 Wohnungen Abstellen neben den Bügeln ist verboten. Der Fahrradkeller ist nur über 2 verschlossene Türen u,8,True,2019-10-04T10:19:36+00:00,,report_verification,,"52.5090769076187,13.4603470200774"
1138,"Paul-Lincke-Ufer 32, 10999 Berlin","Am Ufer keine Anschlussmöglichkeiten für Räder, stattdessen links und rechts parkende Autos. Für Anwohner, Touristen, Kunden der Läden oder Kirchengänger der Ölbergkirche+Kita Kunterbunt wären Fahrradbügel hilfreich.",8,True,2019-10-04T10:59:19+00:00,,report_verification,,"52.4950677250923,13.4244500939141"
1139,"Gärtnerstraße 7, 10245 Berlin","Viele Hausbewohner, Kneipen- und GeschäftsbesucherInnen, und relativ breiter Gehsteig.",5,False,2019-10-04T11:03:48+00:00,,report_verification,,"52.5094995706442,13.4604244820545"
1140,"Mehringdamm 64, 10961 Berlin",Am Mehringdamm zw. Kreuzbergstr. und Hagelbergerstr. gibt es keine Fahrradbügel.,3,False,2019-10-04T12:28:21+00:00,,report_verification,,"52.4907941574457,13.3865009936281"
1141,"Gärtnerstraße 4, 10245 Berlin",Viele läden ohne fahrradständer,7,False,2019-10-04T14:34:18+00:00,,report_verification,,"52.508772,13.4598707"
1142,"Warschauer Straße 44, 10243 Berlin",Vorhandene Abstellplätze reichen nicht aus und sorgen für engen Radweg/Bürgersteig. Ab auf die Straße damit,12,False,2019-10-04T15:26:17+00:00,,report_verification,,"52.5039466661433,13.4476848721963"
1143,"Revaler Straße 34, 10245 Berlin",Auf dem Supermarktparkplatz nicht genug Bügel vorhanden.,5,False,2019-10-04T15:27:23+00:00,,report_verification,,"52.5062328222601,13.4596253907647"
1144,"Lenbachstraße 9, 10245 Berlin",Hier stehen regelmäßig Räder und roller auf engem Gehweg,8,False,2019-10-04T15:28:25+00:00,,report_verification,,"52.5051719990658,13.4662441023643"
1145,"Neue Bahnhofstraße 36, 10245 Berlin",Am Bahnhof Ostkreuz (Neue Bahnhofstraße) reichen die vorhandenen Fahrradbügel überhaupt nicht aus. Eine Umwidmung von ein paar Autoparkplätzen wäre hier sehr sinnvoll.,12,False,2019-10-04T21:52:09+00:00,,report_verification,,"52.50448703783,13.4686166413811"
1146,"Rigaer Straße 79, 10247 Berlin","In dem Haus ist eine Kita. Eltern parken ihre Fahrräder bzw. Fahrradanhänger oft im Hof, der sowieso schon viele Räder der Anwohner beherbergt. Fahrradbügel statt Autoparkplätze würden auch sicher auch nachts genutzt, da einige Bars und Clubs im 25",5,False,2019-10-04T21:58:40+00:00,,report_verification,,"52.5166768112997,13.4641205058338"
1147,"Dieffenbachstraße 27, 10967 Berlin","Viele Fahrraeder, keine Bügel...",12,False,2019-10-04T22:02:45+00:00,,report_verification,,"52.492324369883,13.4173500758665"
1148,"Bänschstraße 36, 10247 Berlin",Patienten von Zahnarztpraxis und Physiotherapie haben keine guten Möglichkeiten ihre Räder sicher anzuschließen. Auf dem Gehweg herrscht manchmal ein kleines Durcheinander von Rädern.,5,False,2019-10-04T22:03:14+00:00,,report_verification,,"52.5183478135879,13.463397668929"
1149,"Rigaer Straße 79, 10247 Berlin","Kita, Anwohner, Clubs und Kneipen haben einen großen Bedarf an Fahrradstellplätzen. Die Höfe sind schon voller Räder.",5,False,2019-10-04T22:06:24+00:00,,report_verification,,"52.5166419536965,13.4638610125793"
1150,"Möckernstraße 91, 10963 Berlin","Es gibt hier keine Abstellmöglichkeiten. Die Laternenmasten sind zu wenig und dick. Der Gehweg ist aber breit. Andere Idee: Autos quer parken, dann können da mehr parken. Die Parksituation ist eine Katastrophe, seit das Möckernkiez bezogen ist. Wie ge",5,False,2019-10-05T07:20:26+00:00,,report_verification,,"52.4929887430439,13.3796238577397"
1151,"Tempelhofer Ufer 17, 10963 Berlin",Übergang zum U-Bahnhof Möckernbrücke.,10,False,2019-10-05T07:23:56+00:00,,report_verification,,"52.4982908874508,13.3829416637832"
1152,"Bergmannstraße 45, 10961 Berlin",Eingang zum friedhof,5,False,2019-10-05T07:24:29+00:00,,report_verification,,"52.4886026827177,13.4038434006691"
1153,"Frankfurter Allee 108, 10247 Berlin","Am U-Bahneingang Frankfurter Allee Richtung Jessnerstraße parken immer sehr viele Fahrräder an Baumscheiben etc, weil es einfach kaum Fahrradständer gibt. Eine Änderung würde ein 'Bike & FIDE' mit der U-Bahn sehr viel bequemer machen",7,False,2019-10-05T08:33:55+00:00,,report_verification,,"52.5134889553956,13.4751310059634"
1154,"Voigtstraße 4, 10247 Berlin","An dieser Kreuzung gibt es einen DM, einen Edeka und eine Bio Company. Täglich kaufen hier viele Familien ein, viele mit Fahrrad. Es reicht meist nicht an Fahrradbügeln, die Fahrräder muss man auf dem Gehweg abstellen.",8,False,2019-10-05T10:53:51+00:00,,report_verification,,"52.5157811928025,13.4680982664679"
1155,"Alt-Stralau 34, 10245 Berlin","Hier befindet sich die Thalia Grundschule, der Schulhof ist erschöpft in Sachen Fahrradständer. Es ist löblich, dass sooooo viele Kinder mit dem Rad kommen, doch aktuell stapeln nicht die Räder auf dem Schulhof und können nicht mehr an Bügeln anges",12,False,2019-10-05T18:04:02+00:00,,report_verification,,"52.4927096852085,13.4758529990517"
1156,"Alt-Stralau 34, 10245 Berlin",Es werden dringend Stellplätze an der Thalia Grundschule benötigt.,12,False,2019-10-05T19:32:24+00:00,,report_verification,,"52.4927888091714,13.4759574441991"
1157,"Alt-Stralau 34, 10245 Berlin",Auf dem bzw am Schulgelände,5,False,2019-10-05T19:55:35+00:00,,report_verification,,"52.4926978703195,13.4758693782908"
1158,"Kottbusser Damm 29, 10967 Berlin",Ganz schlimm für Anwohner und Besucher der vielen Mietwohnungen. Kein Platz zum Fahrrad anschliessen.,12,False,2019-10-05T20:32:51+00:00,,report_verification,,"52.4893851217295,13.4240487634829"
1159,"Skalitzer Straße 94, 10997 Berlin","Viele Kneipen Restaurants. Viel Platz auf dem Grünstreifen, aber keine Anschlussmöglichkeiten. Bitte ändern!",12,False,2019-10-05T20:36:24+00:00,,report_verification,,"52.4995893792954,13.4326290019517"
1160,"Krossener Straße 25, 10245 Berlin",Zu wenig Fahrradstellplätze am Boxhagener Platz.,5,False,2019-10-05T21:52:02+00:00,,report_verification,,"52.5099727322237,13.4607340325661"
1161,"Finowstraße 35, 10247 Berlin",Immer viele Fahrräder auf dem relativ schmalen Gehweg.,3,False,2019-10-05T22:23:15+00:00,,report_verification,,"52.5131345623851,13.4692424769343"
1162,"Skalitzer Straße 105, 10997 Berlin","Hier stehen Räder teils sogar auf dem engen Radweg, da es keine Abstellmöglichkeiten gibt.",3,False,2019-10-05T22:26:59+00:00,,report_verification,,"52.4994248630257,13.4272110832069"
1163,"Alt-Stralau 34, 10245 Berlin",An der Thalia Grundschule können Bügel gebraucht werden.,12,False,2019-10-06T11:38:47+00:00,,report_verification,,"52.4930791375883,13.4759475022247"
1164,"Mariannenplatz 26, 10997 Berlin","Es gibt park, Kirche und Schule in der Nähe.
Es ist auch immer von Auto zugeparkt und die blockieren der Gehweg",6,False,2019-10-06T12:48:51+00:00,,report_verification,,"52.5047324034643,13.4266714493003"
1165,"Eure Kneipe, Weidenweg 60, Berlin, 10247",Die Kneipe ist gerade zu Zeiten von Fußballspielen sehr voll und hat deshalb den Bedarf.,4,True,2019-10-06T12:52:14+00:00,,report_verification,,"52.5191331967967,13.4551314149279"
1166,"Adalbertstraße 91, 10999 Berlin",Würde die Bushaltestelle ergänzen,10,False,2019-10-06T15:33:38+00:00,,report_verification,,"52.5012550903887,13.4192909448254"
1167,"Metropol China Box, Mehringdamm 30, Berlin, 10961","An dieser Stelle stehen viele Räder unabgeschlossen, stören auf dem Fußweg und können wir werden. Wichtiger Zugang zum Dragonerareal und beliebte Ecke mit Imbissen",9,False,2019-10-06T15:36:20+00:00,,report_verification,,"52.4939064176551,13.3881739924651"
1168,"Erich-Steinfurth-Straße 4, 10243 Berlin",Am gesamten Ostbahnhof fehlen Fahrradabstellplätze! Ein Muss an einem zentralen Bahnhof.,12,False,2019-10-06T15:39:12+00:00,,report_verification,,"52.5109485169883,13.4360590556346"
1169,"Holzmarktstraße 25, 10243 Berlin","Vor dem Holzmarkt, Kater Blau und anderen Clubs an der Holzmarktstr fehlen Radabstellplätze, besonders nachts.",10,False,2019-10-06T15:41:17+00:00,,report_verification,,"52.5119386989429,13.4263607080272"
1170,"Falckensteinstraße 44, 10997 Berlin",Dort stehen schon Räder Kreuz und quer,10,False,2019-10-06T15:47:43+00:00,,report_verification,,"52.500014876749,13.4438428468967"
1171,"Wrangelstraße 81, 10997 Berlin",Räderchaos schon da,8,False,2019-10-06T15:48:59+00:00,,report_verification,,"52.4984120807498,13.4423075975193"
1172,"Matthiasstraße 12, 10249 Berlin","Die Ecke ist an der Haltestelle in Kombination mit Ärztehaus.... der Ständer der Apotheke steht da leider nicht mehr nach Ladenschluss. 
Die Ecke ist sicher eine Herausforderung, denn da ist es recht eng. 
Danke und super Idee! 
Jule Kastl",4,False,2019-10-06T15:51:57+00:00,,report_verification,,"52.5237827165453,13.4398225524503"
1173,"Alt-Stralau 35, 10245 Berlin","An dieser Stelle ist eine Grundschule, zu der immer mehr Schüler mit eigenem Fahrrad kommen. Die Fahrradbügel, die die Schule zur Verfügung stellen kann, reichen ist längerem bei weitem nicht aus. Mit freundlichen Grüßen!",10,False,2019-10-07T06:03:52+00:00,,report_verification,,"52.4928580831021,13.4755805511315"
1174,"Gabriel-Max-Straße 1, 10245 Berlin",Bei Besuch eines der vielen Restaurants in der Umgebung kann an dieser Kreuzung/Park kein Fahrrad sicher abgestellt werden.,5,False,2019-10-07T07:16:17+00:00,,report_verification,,"52.5094301279973,13.4577212082582"
1175,"Eisenbahnstraße 21, 10997 Berlin",Dauerhaft keine freien Plätze.,3,False,2019-10-07T07:44:27+00:00,,report_verification,,"52.5039486956245,13.434411557643"
1176,"Köpenicker Straße 173, 10997 Berlin",Es gibt sch 3 Bügel. Diese sind jedoch dauerhaft belegt.,2,False,2019-10-07T07:47:05+00:00,,report_verification,,"52.5042326515585,13.4351494090074"
1177,"Forster Straße 43, 10999 Berlin","Es sind immer mehr Menschen mit dem Fahrrad unterwegs. 
Einige Fahrräder stehen schon nicht angeschlossen auf dem Bürgersteig. 
Es gibt Platz auf dem Bürgersteig.",12,False,2019-10-07T08:02:28+00:00,,report_verification,,"52.4942185478292,13.4326024572875"
1178,"Forster Straße 43, 10999 Berlin",,1,False,2019-10-07T08:59:57+00:00,,report_verification,,"52.4941635581667,13.432671032876"
1179,"Wrangelstraße 61, 10997 Berlin",Es stehen schon welche aber viel zu wenige um den Bedarf vor dem Supermarkt abzudecken.,6,True,2019-10-07T09:43:06+00:00,,report_verification,,"52.497626070387,13.4440542960035"
1180,"Cuvrystraße 15, 10997 Berlin",Vor dem Familienzentrum sind abstellanlagen wichtig um Familien dazu zu ermutigen mit dem Rad zum Zentrum zu kommen.,8,True,2019-10-07T09:44:52+00:00,,report_verification,,"52.4984530391858,13.443658026607"
1181,"Alt-Stralau 34, 10245 Berlin","Es handelt sich um eine Grundschule zu der viele Kinder mit dem Fahrrad kommen, was gut ist (da es dann weniger Stress und Autoverkehr gibt) – nur fehlen dafür weiterhin Fahrradständer. Es wird auch immer mal wieder ein Fahrrad geklaut, da die Fahrra",9,False,2019-10-07T10:00:07+00:00,,report_verification,,"52.4929514583936,13.4758522902412"
1182,"Forster Straße 43, 10999 Berlin","Es werden bereits Räder abgestellt, z. T. auf den Baumscheiben",6,True,2019-10-07T11:46:26+00:00,,report_verification,,"52.4942242232643,13.4322981698928"
1183,"Fürbringerstraße 23, 10961 Berlin","Die Kreuzung Mittenwalder & Fürbringerstr. verfügt über ein paar Fahrradbügel, dennoch gibt es oft nicht genug Platz.",1,False,2019-10-07T12:21:52+00:00,,report_verification,,"52.4930873829419,13.3972052706225"
1184,"Köpenicker Straße 172, 10997 Berlin",Es gibt im Hause eine Kita und eine Schauspielausbildung. Es werden regelmässig Räder an Verkehrschildern oder Gehwegumrandungen angeschlossen.,12,False,2019-10-07T12:38:06+00:00,,report_verification,,"52.5043330228959,13.4350259129191"
1185,"Pablo-Neruda-Bibliothek, Frankfurter Allee 14a, Berlin, 10247","Vor der Pablo-Neruda-Bibliothek stehen die Fahrräder bisher ungesichert herum, ein Durchkommen ist schwer. Und teilweise hält man sich ja stundenlang in der Bibliothek auf.",8,False,2019-10-07T14:16:57+00:00,,report_verification,,"52.5146689839727,13.4570662137265"
1186,"Möckernstraße 67, 10965 Berlin",In der Möckernstr. 69 befindet sich die Tanzfabrik mit definitiv zu wenig Fahrradabstellplätzen.,12,False,2019-10-07T14:19:03+00:00,,report_verification,,"52.4908238532434,13.3791783516499"
1187,"Lasdehner Straße 13, 10243 Berlin","Ein paar Stellplätze für die Bewohner des blauen Hauses wären schön, zumal ausreichend Parkplätze für Autos vorhanden sind.",3,False,2019-10-07T14:39:19+00:00,,report_verification,,"52.5146839582223,13.4497819999353"
1188,"Gärtnerstraße 11, 10245 Berlin",Die ganze GärtnerStraße entlang werden MietFahrräder einfach irgendwo abgestellt oder hingelegt. Außerdem stehen in den Wohnhäusern oft  nicht genügend FahrradParkplätze zu Verfügung und somit enden diese Fahrräder auch auf der Straße.  Denke a,8,False,2019-10-07T17:12:20+00:00,,report_verification,,"52.5103532590007,13.4604833370666"
1189,"Grafton Thüringer Wurstspezialitäten, Boxhagener Platz, Berlin, 10245",Denke am Boxhagener Platz sind mehrere Fahrradbügel sinnvoll.  Auch für Anwohner wäre es nach kurzem Fußweg ein sinnvoller Parkplatz fürs Fahrrad.,8,False,2019-10-07T17:19:14+00:00,,report_verification,,"52.5103543023372,13.4603901587716"
1190,"Holteistraße 19, 10245 Berlin",Nix,6,False,2019-10-07T18:22:15+00:00,,report_verification,,"52.5096088555432,13.4671102074751"
1191,"Weichselstraße 18, 10247 Berlin",Bitte.,3,True,2019-10-07T18:23:38+00:00,,report_verification,,"52.5103900507917,13.4678680553051"
1192,"Schmitts Café, Oderstr. 8, Berlin, 10247",Regelmäßig viele Räder vor der Kneipe.,5,False,2019-10-07T18:25:11+00:00,,report_verification,,"52.5111159829023,13.4685846870774"
1193,"Finow Getränke, Finowstr., Berlin, 10247",Es parken hier meistens Autos im Kreuzungsbereich.,3,False,2019-10-07T18:26:26+00:00,,report_verification,,"52.5115307921695,13.4673331690069"
1194,"Jungstraße 16, 10247 Berlin",Ja,3,True,2019-10-07T18:28:12+00:00,,report_verification,,"52.5115851654258,13.4658817585691"
1195,"Weserstraße 22, 10245 Berlin","Spielplatz, Kneipen und zu wenig Platz fürs Rad. Die 6 vorhandenen Bügel sind immer voll.",5,False,2019-10-07T18:30:53+00:00,,report_verification,,"52.5110079411462,13.4640962934224"
1196,"Grünberger Straße 81, 10245 Berlin",Hier gibt es sechs Bügel. Die reichen aber nicht aus und sind auf dem Gehweg montiert.,9,False,2019-10-07T18:33:58+00:00,,report_verification,,"52.511067331628,13.4608364727529"
1197,"Krossener Straße 10, 10245 Berlin",Ist am Boxi an allen vier Ecken das gleich: die Fahrradstander reichen nicht aus und sollten vom Platz auf die Straße verlegt werden.,9,False,2019-10-07T18:35:38+00:00,,report_verification,,"52.5102703926957,13.4604970802188"
1198,"Schwesterherz, Gärtnerstr. 28, Berlin, 10245",An jedem Baum oder Schild sind Räder angekettet.,5,False,2019-10-07T18:36:39+00:00,,report_verification,,"52.5094697155022,13.4602950443664"
1199,"Wühlischstraße 42, 10245 Berlin",Vorhandene Ständer auf dem Bürgersteig reichen nicht aus.,9,True,2019-10-07T18:37:18+00:00,,report_verification,,"52.5086917890734,13.4606462113561"
1200,"Wühlischstraße 44, 10245 Berlin","Hier wurden ein paar Fahrradstander auch helfen, die kreuzung für Fußgänger freizuhalten,",7,False,2019-10-07T18:38:11+00:00,,report_verification,,"52.5085200010916,13.4614391540039"
1201,"Sonntagstraße 21, 10245 Berlin","Zu viele Parkplätze für Autos, kein Platz fürs Rad.",6,False,2019-10-07T18:40:43+00:00,,report_verification,,"52.507457271146,13.4640381385136"
1202,"Holteistraße 30, 10245 Berlin","Bitte einen Autoparkplatz umwidmen,",5,False,2019-10-07T18:41:45+00:00,,report_verification,,"52.5067835487183,13.4646089124263"
1203,"Loveco, Sonntagstraße 29, Berlin, 10245",Die wenigen Abstellplätze auf dem Bürgersteig sind immer überfüllt. Das gilt für die gesamte Sonntagstraße,9,False,2019-10-07T18:43:05+00:00,,report_verification,,"52.5060457877293,13.465770305416"
1204,"Lenbachstraße 8, 10245 Berlin",.,8,False,2019-10-07T18:43:42+00:00,,report_verification,,"52.5053863125483,13.4666118327218"
1205,"Café Uebereck, Lenbachstr. 8, Berlin, 10245",Cafe Ubereck. Außerdem blockieren hier Autos jeden Abend den Weg für Fußgänger über die kreuzung,4,False,2019-10-07T18:44:45+00:00,,report_verification,,"52.505412917771,13.4665621797471"
1206,"Simplonstraße 62, 10245 Berlin",Vorhandene Bügel sind überfüllt. Viel Vandalismus. Am besten mit Kamera.,12,False,2019-10-07T18:45:34+00:00,,report_verification,,"52.5044475980134,13.4676461686064"
1207,"Thaerstraße 21, 10249 Berlin","Thaerstraße 21/22 sind zwei Wohnhäuser, der Bürgersteig ist breit, so dass Fahrradbügel keine Behinderung für Fußgänger etc. darstellen würden.
Bisher werden Fahrräder an „Baumbügel“ angeschlossen, die ja eigentlich zum Schutz der Bäume ge",10,False,2019-10-07T18:46:20+00:00,,report_verification,,"52.5202283377239,13.4546514904298"
1208,"Simplonstraße 61, 10245 Berlin",Eingang zum Spielplatz. Hier sind bislang nur zwei fahrradständer. Bei gutem Wetter immer voll.,6,False,2019-10-07T18:48:49+00:00,,report_verification,,"52.5052230795852,13.464644470913"
1209,"Barwas, Helmerdingstr. 2, Berlin, 10245",Xxx,5,False,2019-10-07T18:49:36+00:00,,report_verification,,"52.5058280443272,13.4635071198595"
1210,"Revaler Straße 28, 10245 Berlin",Wenn Büros fertig sind und die Straße gemscht wird.,6,False,2019-10-07T18:58:39+00:00,,report_verification,,"52.505205216698,13.4627064477655"
1211,"Gärtnerstraße 3, 10245 Berlin",X,5,False,2019-10-07T19:01:15+00:00,,report_verification,,"52.5083915911368,13.4598428879248"
1212,"Helmerdingstraße 1, 10245 Berlin",hier,3,False,2019-10-07T19:06:28+00:00,,report_verification,,"52.5055594594322,13.4634460696797"
1213,"Möckernstraße 68, 10965 Berlin","Täglich wird die Tanzfabrik von vielen FahrradfahrerInnen besucht. Extra Möglichkeiten Fahrräder sicher abzustellen würde sehr der Gemeinschaft helfen, denn der Innenhof ist so gut wie immer voll. (Jeden Tag gibt es mehrere Trainings-Einheiten in 4-5",7,False,2019-10-07T19:20:06+00:00,,report_verification,,"52.4907503860781,13.3793402115866"
1214,"Revaler Straße 18, 10245 Berlin",RAW,9,False,2019-10-07T19:33:55+00:00,,report_verification,,"52.5069759459442,13.4574472200634"
1215,"Mutzenbacher’s Speisen, Libauer Str. 11, Berlin, 10245",Autos parken auf kreuzung,6,False,2019-10-07T19:34:34+00:00,,report_verification,,"52.508334187666,13.4528920151295"
1216,"Hausburgstraße 3, 10249 Berlin",Beim S-Bahnhof und am neu gebauten Einkaufszentrum besteht weiterer Bedarf.,8,False,2019-10-07T19:45:22+00:00,,report_verification,,"52.5275076795769,13.4522590245199"
1217,"Lehmbruckstraße 1, 10245 Berlin","Insbesondere am nördlichen Teil der Lehmbruckstrasse zur Ecke Rudolfstrasse stehen sehr viele Fahrräder der Anwohner und in den umliegenden Gewerben Beschäftigten an den Häuserwänden, Verkehrsschildern, den wenigen Bügeln zum Schutz der Bäume. Es",12,True,2019-10-07T21:14:08+00:00,,report_verification,,"52.5040092549013,13.4537010568898"
1218,"Mittenwalder Straße 20, 10961 Berlin",Bitte,6,True,2019-10-07T21:26:12+00:00,,report_verification,,"52.4916363841066,13.3964678246753"
1219,"Karl-Marx-Allee 112, 10243 Berlin","Es gibt dort den Mc Trek laden, wo viele Fahrradfahrer einkaufen gehen.",4,False,2019-10-07T21:44:46+00:00,,report_verification,,"52.5164647329949,13.4464525604185"
1220,"Möckernstraße 68, 10965 Berlin","Hier befindet sich die Tanzfabrik, in der täglich Tanzklassen sowie Proben stattfinden. Es gibt beinahe immer Probleme, einen Platz für das Fahrrad zu finden, ohne andere NutzerInnen des Gebäudes zu behindern.",12,False,2019-10-08T06:26:51+00:00,,report_verification,,"52.4906888695226,13.3792304543272"
1221,"Möckernstraße 68, 10965 Berlin","Es ist vor der Tanzfabrik, Möckernstr 68. DA kommen sehr viele Besucherinnen mit dem Rad, die man dort nicht abstellen kann.",10,False,2019-10-08T07:10:53+00:00,,report_verification,,"52.4907260425987,13.3791949285435"
1222,"Sonntagstraße 2, 10245 Berlin",Auf dem Gehweg ist nicht genug Platz für alle Räder.,7,False,2019-10-08T08:19:36+00:00,,report_verification,,"52.5045892707033,13.4675386186238"
1223,"BBB, Sonntagstr. 1, Berlin, 10245",Hier ist nur ein einlezner ständer auf dem Bürgersteig,7,False,2019-10-08T08:20:21+00:00,,report_verification,,"52.5045138845168,13.467861290745"
1224,"a 100, 10245 Berlin",Am ostkreuz wird ein richtiges Fahrradparkhaus gebraucht,12,False,2019-10-08T08:22:36+00:00,,report_verification,,"52.5037650514862,13.4675404544992"
1225,"Matkowskystraße 4, 10245 Berlin",Ja,6,False,2019-10-08T08:23:09+00:00,,report_verification,,"52.5048140152776,13.4642281336345"
1226,"Sonntagstraße 24, 10245 Berlin",Biergarten. Hier ist es bei schönem Wetter immer voll.,5,False,2019-10-08T08:23:52+00:00,,report_verification,,"52.5067126849908,13.4650509396129"
1227,"Großbeerenstraße 79, 10963 Berlin","Beliebte Shisha-Bar, Café, Pizza-Imbiss im Haus Großbeerenstr. 79 und den angrenzenden Häusern. Viel Publikumsverkehr. Auf dem Gehweg ist wegen der draußen stehenden Tische kein Platz für Fahrräder.",4,False,2019-10-08T08:29:03+00:00,,report_verification,,"52.497260331522,13.3847941314821"
1228,"Möckernstraße 68, 10965 Berlin","An diesem Ort befinden sich viel zu wenig Fahrradständer. Der Hausmeister des Gebäudes, indem sich Tanzschulen, Büros und Wohnungen befinden entfernt außerdem alle Fahrräder, die außerhalb des viel zu kleinen Fahrrad-Abstellbereichs befinden",12,False,2019-10-08T08:43:00+00:00,,report_verification,,"52.4907095158425,13.3791304151821"
1229,"Wasserfall Viktoriapark, Kreuzbergstr., Berlin, 10965","An diesem Ort werden Bügel für den öffentlichen Raum, Touristen und Anwohner benötigt, die den Park und das Denkmal am Wasserfall besuchen.
Meist werden derzeit Fahrräder mangels anderer Möglichkeiten an den Einfahrtsschranken angeschlossen.",5,False,2019-10-08T08:47:07+00:00,,report_verification,,"52.4889480080458,13.3818703395195"
1230,"Alt-Stralau 35, 10245 Berlin",Vor der Thalia Schule fehlen Plätze für die Räder der Kinder.,12,False,2019-10-08T09:06:09+00:00,,report_verification,,"52.4928728358469,13.4755500030641"
1231,"Lausitzer Straße 28, 10999 Berlin",Vor der Ölberg-Kita fehlen weitere Bügel zum Anschließen der Räder von Eltern.,5,False,2019-10-08T09:09:01+00:00,,report_verification,,"52.4949200303986,13.4265215461206"
1232,"Kottbusser Damm 36, 10967 Berlin",sg,6,True,2019-10-08T09:55:52+00:00,,report_verification,,"52.4884078122641,13.4246570743699"
1233,"Friedrichstraße 21, 10969 Berlin",Es fehlt für die Besucher*innen des taz-Gebäudes an Abstellmöglichkeiten für Räder.,4,False,2019-10-08T11:16:44+00:00,,report_verification,,"52.5032310732564,13.391172424632"
1234,"Hauptstraße 1, 10317 Berlin",Unmittelbar vor den Aufgängen zur Ringbahn bzw. zum Regionalbahnsteig werden dringend sehr viele Fahrradbügel benötigt. Der Abstellplatz in der Kynaststr. reicht bei Weitem nicht aus. Bislang schließen die unzähligen Radfahrer ihre Räder immer an d,12,False,2019-10-08T11:20:35+00:00,,report_verification,,"52.5024171574877,13.4694030681711"
1235,"Alt-Stralau 34, 10245 Berlin","Auf dem Schulhof der Thalia-Grundschule, Tunnelstr. 34, befinden sich zu viel zu wenige Fahrradbügel für die Massen an Rädern und Rollern, die dort jeden Tag abgestellt werden.",10,False,2019-10-08T11:28:11+00:00,,report_verification,,"52.4928731550734,13.4761570476347"
1236,"Krossener Straße 33, 10245 Berlin",Bedarf ist da! Viele Fahrräder von Anwohnern auf dem Gehweg und Baumscheiben abgestellt.,3,False,2019-10-08T12:06:54+00:00,,report_verification,,"52.5096904722371,13.4634996052851"
1237,"Möckernstraße 68, 10965 Berlin","Es sind viele die zur Tanzschulen mit dem Fahrrad fahren und die vorhandenen Plätze sind schon voll, es wäre schön wenn man mehr davon hat ! Danke",10,False,2019-10-08T13:06:07+00:00,,report_verification,,"52.4905522399747,13.3789725079935"
1238,"Jüterboger Straße 3, 10965 Berlin","Kfz Anmeldestelle, weit und breit kein Bügel.",2,False,2019-10-08T13:45:59+00:00,,report_verification,,"52.486338475126,13.3979148095402"
1239,"Dieffenbachstraße 65, 10967 Berlin","Unsinnige alte Fahrradständer neben Baumscheibe, sind immer zugeparkt.",4,False,2019-10-08T13:47:21+00:00,,report_verification,,"52.4932856860203,13.4138006564176"
1240,"Forster Straße 43, 10999 Berlin",Vor dem Haus zwischen den Beeten,12,False,2019-10-08T14:37:49+00:00,,report_verification,,"52.4941831731163,13.4325856860343"
