ID,Adresse,Beschreibung,Nummer,Auch mit Gebühr,created,likes,Status,status_reason,position
498,"Köthener Straße 33, 10963 Berlin",Hier gibt es ein massives Problem für Fußgänger mit permanent zugeparkten Eckbereichen. Die Aufstellung von Radbügeln iVm Pollern und markierten Übergängen würde das Problem lösen.,12,False,2019-09-14T05:58:18+00:00,,report_verification,,"52.5053887265123,13.3764322473728"
499,"Eisenbahnstraße 22, 10997 Berlin","Hier gab es bis vor kurzem eine große Abstellfläche für viele Fahrräder auf der Straße, die wurde aber entfernt. Wieder installieren wäre super. Bedarf ist riesig. Mehr als 12 Bügel.",12,False,2019-09-14T06:07:38+00:00,,report_verification,,"52.5041257057002,13.4344777350767"
500,"F5, Falckensteinstr. 5, Berlin, 10997","Hier fehlen zahlreiche Radbügel (Café, Gastronomie, Begegnungsstätte) die Umwandlung von zwei Parkplätzen vor dem Späti würde das Problem entspannen. Insgesamt fehlen im gesamten Wrangelkiez an fast allen Ecken Radbügel.",12,False,2019-09-14T06:12:04+00:00,,report_verification,,"52.4995156443962,13.4432510961394"
501,"Lausitzer Straße 46, 10999 Berlin",Vor dem Café fehlen viele Radbügel. Gehweg ist dadurch zugestellt mit Rädern. Umwandlung von 3 Parkplätzen ist die Lösung.,12,False,2019-09-14T06:18:17+00:00,,report_verification,,"52.4976303303408,13.4293593588176"
502,"Manteuffelstraße 81, 10999 Berlin",Vor der Hunsrückschule gibt es ein massives Problem mit Zweite Reihe parken und Elterntaxis. Hingegen gibt es keine Radbügel im öffentlichen Raum. Diese könnten auch die Probleme mit den Autos eindämmen.,12,False,2019-09-14T06:21:10+00:00,,report_verification,,"52.4981833552287,13.4255158679204"
503,"Wühlischstraße 44, 10245 Berlin","An der Ecke ist sowohl eine Kita als auch eine Bäckerei, daher stehen hier oft Fahrräder auf dem Gehweg. Zudem ist die Kreuzung oft zugeparkt. Fahrrad bügel könnten beides verhindern.",5,True,2019-09-14T08:49:07+00:00,,report_verification,,"52.5084845017211,13.4614900836755"
504,"Seumestraße 16, 10245 Berlin",Vor einen Fahrradladen gehören auch Fahrradbügel ;),4,False,2019-09-14T08:51:15+00:00,,report_verification,,"52.5106274999122,13.4626947462637"
505,"Rigaer Straße 68, 10247 Berlin","An dieser Kreuzung gibt es zwar schon ein paar Radbügel, aber durch die Kunden der bio company sind diese meist belegt.",3,False,2019-09-14T10:58:56+00:00,,report_verification,,"52.5159174956719,13.4679924202522"
506,"Wilmsstraße 23, 10961 Berlin",,3,False,2019-09-14T11:32:18+00:00,,report_verification,,"52.4955149011297,13.4019743170275"
507,"Friesenstraße 27, 10965 Berlin",Vor der Marheinekehalle fehlen Fahrradbügel,12,False,2019-09-14T13:17:07+00:00,,report_verification,,"52.4888536410226,13.3944946955262"
508,"Gneisenaustraße 39, 10961 Berlin",Für die Reinhardtswaldschule fehlen Fahrradbügel  - allerdings stellt sich die Frage warum die Schüler die Fahrräder nicht auf dem Schulgelände parken dürfen (wie üblich)?,12,False,2019-09-14T13:20:56+00:00,,report_verification,,"52.4900380236041,13.3992957933829"
509,"Puttkamerstraße 4, 10969 Berlin",Vor der Fahrerlaubnisbehörde fehlen Fahrradbügel.,12,False,2019-09-14T13:23:06+00:00,,report_verification,,"52.5043036126173,13.3893556514784"
510,"Heimstraße 11, 10965 Berlin","An der Ecke Heimstraße/Jüterboger Str. in 10965 Berlin wohnen und arbeiten viele Menschen, die mit dem Fahrrad unterwegs sind, weswegen zumeist alle Pfähle von Verkersschildern und Laternenmasten belegt sind. Eigentlich sollten auf beiden Seiten der H",4,False,2019-09-14T15:26:17+00:00,,report_verification,,"52.4865468888388,13.3964779364093"
511,"Urbanstraße 110, 10967 Berlin","Am der Stelle parken Falschparker die Sichtbeziehung an der Kreuzung zu 
Oft auch Transporter / SUVs

Aisserdem stehen dort immer sehr viele Leih-Fahrräder Roller die besser an Bügeln zwischen Radweg und Straße aufgehoben wären",7,False,2019-09-14T19:35:01+00:00,,report_verification,,"52.4899846263766,13.4194991183253"
512,"Erkelenzdamm 3, 10999 Berlin","Platz da, Bügel fehlen",11,False,2019-09-14T20:57:54+00:00,,report_verification,,"52.5011405577057,13.4159612813646"
513,"Reichenberger Straße 64, 10999 Berlin",Unbedingt mehr Plätze nötig für die Schülerräder,12,False,2019-09-14T20:59:52+00:00,,report_verification,,"52.4950285785354,13.4312195677769"
514,"Ohlauer Straße 43, 10999 Berlin","Rund um den Pavillon mit Eis und Waffeln stehen überall Räder, hier braucht es dringend radstander",12,False,2019-09-14T21:04:25+00:00,,report_verification,,"52.4937811374715,13.4285789029833"
515,"Ohlauer Straße 30, 10999 Berlin",Die Bügel hier sind immer übervoll. Gerade auch für Eltern der Kinder vom Spielplatz gegenüber und für die Umsteiger auf den Bus,12,False,2019-09-14T21:06:38+00:00,,report_verification,,"52.4953763825105,13.4300971645285"
516,"Grimmstraße 28, 10967 Berlin",Dringend nötig,12,False,2019-09-14T21:08:06+00:00,,report_verification,,"52.4945759684921,13.4152111603188"
517,"Wochenmarkt Boxhagener Platz, Boxhagener Platz, Berlin, 10245",Auf der Seite vom Boxi gibt es keine vernünftige Möglichkeit das Fahrrad abzuschließen. Deswegen stehen immer alle Fahrräder (unsicher abgeschlossen) auf dem Gehweg,12,False,2019-09-15T05:36:51+00:00,,report_verification,,"52.5110477394156,13.4598606632501"
518,"Wiener Straße 49, 10999 Berlin","Es gibt an der unbebauten Straßeseite zum Sportplatz in der Wiener Straße überhaupt keine Fahrradbügel (Von wi Glogauerst. bis hinten zur Ratiborstraße kein einziger Radbügel)
So sind (nicht nur mir) mir bereits zwei Fahrräder gestohlen worden wei",1,False,2019-09-15T08:14:24+00:00,,report_verification,,"52.4948073440287,13.440348965203"
519,"Mehringdamm 114, 10965 Berlin","Das ist die Adresse von einem Familienzentrum, wo ganz viele Familien mit dem Rad kommen und es gibt noch ein paar unbequeme Fahrradständer.",5,False,2019-09-15T10:03:21+00:00,,report_verification,,"52.4859700793161,13.3871931097942"
520,"Großbeerenstraße 56, 10965 Berlin","Tierarztpraxis, viele Kunden kommen mit einem Lastend.",3,False,2019-09-15T10:06:19+00:00,,report_verification,,"52.4922968283267,13.3831113386529"
521,"Paul-Lincke-Ufer 21, 10999 Berlin",Im Kreuzberger Umspannwerk entsteht ein neuer Capmpus für soziales Engagement + CoWorking + Veranstaltungen. Vor der Türe braucht es Fläche um sein Fahrrad abzustellen. (https://www.betterplace.org/c/neues/haus),10,True,2019-09-15T10:23:45+00:00,,report_verification,,"52.4937182934109,13.4294142668135"
522,"Koppenstraße 41, 10243 Berlin",Hier gibt es weit und breit keinen richtig Platz um ein Fahrrad abzustellen. Leute ketten ihre Räder an Bauzäune..,2,False,2019-09-15T11:26:37+00:00,,report_verification,,"52.5191273057411,13.4370708232824"
523,"Haasestraße 4, 10245 Berlin","Mindestens 2 Lastenräder, viele Kinderräder und einige Erwachsenenräder würden sehr gerne auf dieser Seite der Haasestr. auf der Straße stehen können.
Da die Straße bis Ende 2019 erst fertig gestellt wird, ist unklar, wie viele Bügel an der Stell",8,False,2019-09-15T12:58:16+00:00,,report_verification,,"52.5066273898803,13.4614504139116"
524,"Katzbachstraße 14, 10965 Berlin","Dann könnten wir auch unsere 
Rollatoren abstellen.
Aber der florian hält ja nix von alte Leute.
Aber trotzdem danke.",8,False,2019-09-15T16:19:34+00:00,,report_verification,,"52.4884539601934,13.3768842840168"
525,"Netto Marken-Discount, Landsberger Allee 62b, Berlin, 10249","Es befinden sich dort keine Möglichkeiten sein Fahrrad anzuschließen . Denn auf dem Abschnitt befinden sich neben Netto noch eine Tanzschule , Rewe und kleinere Geschäfte",3,False,2019-09-15T16:28:13+00:00,,report_verification,,"52.5252099610553,13.4449799819477"
526,"a 100, 10245 Berlin",-,12,False,2019-09-15T17:13:43+00:00,,report_verification,,"52.5041239093281,13.4680284453285"
527,"Frankfurter Allee 70, 10247 Berlin",-,4,False,2019-09-15T17:16:56+00:00,,report_verification,,"52.5143398639524,13.4670346483852"
528,"Prinzenstraße 40, 10969 Berlin","U-Bahnhof, Kita, Supermarkt, Hotel, Szene Treff usw.",12,False,2019-09-15T18:13:05+00:00,,report_verification,,"52.5041804491941,13.4109117675431"
529,"Müllenhoffstraße 15, 10967 Berlin","Die Bewohner der Hausnummer 15 stellen ihre Räder bei den Nachbarhäusern ab, die das natürlich nicht gut finden. Dort quetschen sich bis zu 6 Räder auch mit Kinder -und Lastenanhängern an einen Bügel. Ich habe mir schon oft blaue Flecken geholt, be",3,False,2019-09-15T18:45:51+00:00,,report_verification,,"52.492074092204,13.4154022479439"
530,"a 100, 10245 Berlin",.,12,False,2019-09-15T22:00:44+00:00,,report_verification,,"52.5041546534221,13.4683550061388"
531,"Sozialraum, Rotherstraße 16, Berlin, 10245",Neues Bürohaus entsteht dort,3,True,2019-09-15T22:42:07+00:00,,report_verification,,"52.5044176011288,13.4490280929202"
532,"Finowstraße 20, 10247 Berlin","Viele Fahrräder von AnwohnerInnen, die auf dem Gehweg abgestellt werden.",3,False,2019-09-16T05:30:02+00:00,,report_verification,,"52.510239213683,13.4663263549929"
533,"Weserstraße 20, 10245 Berlin","Da die Fußgängerfurt hier jeden Morgen aufs Neue zugeparkt ist, hilft es vielleicht, rechts und links des Fußgängerübergangs Radbügel zu installieren und somit den Platz für Autos zu verengen. Bedarf für Radabstellplätze ist im Kiez eh hoch.",2,False,2019-09-16T05:35:09+00:00,,report_verification,,"52.5106837122674,13.4648822080471"
534,"Körtestraße 17, 10967 Berlin",Vor dem Haus sind die verfügbaren Fahrradbügel ständig überbelegt.,5,False,2019-09-16T05:52:06+00:00,,report_verification,,"52.4904170369504,13.4103071821116"
535,"Karl-Marx-Allee 54, 10243 Berlin","Es gibt hier zahlreiche Geschäfte (Eisdiele, Bioladen,Apotheke) und vor allem den U Bahn Eingang der U5 Strausberger Platz. Am Straßenrand der Karl-Marx-Allee sind nur wenige Bügel. Diese sind nur von einer Seite, der am Radweg, da sie sehr dicht an d",12,True,2019-09-16T06:10:12+00:00,,report_verification,,"52.5179259176185,13.4298502063145"
536,"Finowstraße 4, 10247 Berlin","Hier in der Finowstr in Friedrichshain fehlen in der gesamten Straße Fahrradbügel. Die meisten Fahrräder sind an der Häuserwand, am Baum oder sonst wo angeschlossen. Deshalb sollten hier in der Straße unbedingt Fahrradbügel angebracht werden.",12,True,2019-09-16T06:43:15+00:00,,report_verification,,"52.5130957208601,13.4690167436841"
537,"Reichenberger Straße 174, 10999 Berlin","Die vorhandene Parkbucht in dem kurzen Abschnitt der Reichenbergerstr., der dort Einbahnstraße ist eigent sich perfekt für Fahrradbügel. Der U-Bahneingang ist dann auch nicht weit.",8,False,2019-09-16T07:27:32+00:00,,report_verification,,"52.4993738278509,13.4174100422122"
538,"Frankfurter Allee 96, 10247 Berlin","Viele sind auf der Frankfurter Allee unterwegs. Man kann auch dort einkaufen gehen, zBsp. Ring Center, nur fehlen Mengen an Bügeln.",12,False,2019-09-16T08:15:27+00:00,,report_verification,,"52.5134658225177,13.4723816414232"
539,"Friedrichstraße 21, 10969 Berlin","Um das taz-Haus herum gibt es bislang so gut wie keine vernünftige Abstellmöglichkeit für Fahrräder. Höchste Zeit, das zu ändern!",12,False,2019-09-16T09:31:54+00:00,,report_verification,,"52.503388798449,13.3914112976707"
540,"Proskauer Straße 36, 10247 Berlin",In der Proskauer Straße an der Einfahrt zur Liebigstraße sind die Sichtbeziehungen superschlecht und werden durch geparkte Autos noch zusätzlich eingeengt. Deshalb sollten hier Parkplätze mit Fahrradabstellanlagen belegt werden. Super Initiative! Vie,3,False,2019-09-16T09:59:56+00:00,,report_verification,,"52.5159821107767,13.4604953167553"
541,"Adalbertstraße 96, 10999 Berlin",Hier gibt es zwar schon Bügel - aber die sind nicht ausreichend,12,False,2019-09-16T10:11:08+00:00,,report_verification,,"52.4999518326732,13.4182321315941"
542,"Hasenheide 3, 10967 Berlin",Hier braucht es noch mehr Bügel,12,False,2019-09-16T10:12:30+00:00,,report_verification,,"52.486577364324,13.4234737128953"
543,"Am Wriezener Bahnhof 1, 10243 Berlin","Hallo, wenn ich mit meinem Fahrrad zum Berghain Club möchte, dann war bisher nur die Möglichkeit gegeben mein Rad an Zäunen anzuschließen. Fahrradbügel wären da schöner und das Wildparken weniger. Danke",10,True,2019-09-16T10:37:00+00:00,,report_verification,,"52.5105747746273,13.4420192115724"
544,"Vdek, Askanischer Platz 1, Berlin, 10963","Hier sind Arztpraxen und ein Bistro. Außerdem der S-Bahnhof, an dem die Radbügel immer überfüllt sind.

Räder werden derzeit an Gitter wild angeschlossen:
https://www.mapillary.com/app/?lat=52.50520389997223&lng=13.381128900000022&z=18.2570124042399",12,False,2019-09-16T11:03:25+00:00,,report_verification,,"52.5048093041864,13.3814900211676"
545,"Friedenstraße 15, 10249 Berlin",Eingang zum Volkspark Friedrichshain,6,False,2019-09-16T11:30:03+00:00,,report_verification,,"52.5252322465456,13.4298302572442"
546,"Friedenstraße 37, 10249 Berlin",Hoher Bedarf an Stellplätzen für Lidl,8,False,2019-09-16T11:32:08+00:00,,report_verification,,"52.5219865058969,13.4349881910457"
547,"Mühlenstraße 76, 10243 Berlin",Autoparkplätze eliminieren um Dooringzone zu entschärfen.,12,False,2019-09-16T11:34:19+00:00,,report_verification,,"52.5026904015728,13.4462369772024"
548,"Hafenplatz 2, 10963 Berlin","Bügel könnten Radparken vor dem Park ermöglichen und gleichzeitig Falschparker vor den Blumenbeeten abhalten:

https://www.mapillary.com/app/?lat=52.50339346916667&lng=13.377245385000037&z=17&focus=photo&pKey=LjiaFPR7I6w2yZruwS798w&x=0.170360286588551",2,False,2019-09-16T11:38:16+00:00,,report_verification,,"52.5032143780933,13.3776213415897"
549,"Stresemannstraße 36, 10963 Berlin","Im Mittelbereich der Stresemannstraße sind immer Räder an den Gittern angeschlossen.

https://www.mapillary.com/app/?lat=52.50339346916667&lng=13.377245385000037&z=17&focus=photo&pKey=LjiaFPR7I6w2yZruwS798w&x=0.17036028658855107&y=0.5963293088044468&zo",5,False,2019-09-16T11:42:51+00:00,,report_verification,,"52.5008377429489,13.386952979694"
550,"Stresemannstraße 27, 10963 Berlin","Rad abschließen beim HAU1 nicht möglich.
Ein Parkplatz gegen Radabstellbügel tauschen, würde auch gleichzeitig die Sichtachse für den Überweg der Fußgänger verbessern:

https://www.mapillary.com/app/?lat=52.500287555&lng=13.387565100555548&z=18.6",5,False,2019-09-16T11:45:40+00:00,,report_verification,,"52.500035587229,13.3875140775867"
551,"Bernburger Straße 25, 10963 Berlin","Direkt vor der htwk, um Studenten das sichere Abstellen zu ermöglichen.",3,False,2019-09-16T11:49:25+00:00,,report_verification,,"52.5052327123173,13.3779567589877"
552,"Dessauer Straße 8, 10963 Berlin","Direkt vor BTK, da hier immer Räder auf dem Gehweg geparkt werden:
https://www.mapillary.com/app/?lat=52.50581749997221&lng=13.379101600000013&z=19.058198740965434&focus=photo&pKey=uDydf-6lbwdrn1GzvEgj4g&x=0.25595189182697314&y=0.46809691895770594&zoom=",6,False,2019-09-16T11:54:51+00:00,,report_verification,,"52.5059475220186,13.3791349170771"
553,"Dessauer Straße 36, 10963 Berlin","An dieser Ecke steht fast immer ein falschparker im 90°-Winkel zur Fahrbahn. Dadurch teilweise auf dem Gehweg.
Durch Bügel könnte dies unterbunden werden und gleichzeitig zwei Fahrrädern platz geboten werden.

https://www.mapillary.com/app/?lat=52.50",1,False,2019-09-16T12:00:46+00:00,,report_verification,,"52.5056071039086,13.3789859259341"
554,"Luckenwalder Straße 6, 10963 Berlin","Bahnhof Gleisdreieck benötigt unbedingt weitere Abstellanlagen. 3 PWK-Stellplätze könnten umgewidmet werden.
Wäre gut einsichtbare Stelle, die auch Diebstahl vorbeugen würde:

https://www.mapillary.com/app/?lat=52.50057580000001&lng=13.3741138999722",12,False,2019-09-16T12:06:20+00:00,,report_verification,,"52.5005306465816,13.3743639680099"
555,"Mariannenstraße 51, 10997 Berlin",Es gibt an der Ecke ein paar bügel aber die sind immer Radvoll. Für die BewohnerInnen gibt es keine Möglucjkeit das Rad auch nur mal schnell abzustellen... es gibt spätis/ einen Supermarkt/ Restaurant und Bar dort und keine freien Fahrradbügel,5,False,2019-09-16T12:36:06+00:00,,report_verification,,"52.501421401301,13.4239341692496"
556,"Skalitzer Straße 128, 10999 Berlin","Das ist direkt vor der Bio Company. Die Kunden stellen die Räder dort auf Fuß und Radweg ab. Alles ist dramatisch eng, besonders weil der Radweg schon so prekär ist. Fahrradbügel auf dem Parkstreifen wären richtig.",12,False,2019-09-16T12:39:13+00:00,,report_verification,,"52.4991701825337,13.4210228332782"
557,"Grimmstraße 26, 10967 Berlin","Viele Leute, keine Abstellmöglichkeiten",8,False,2019-09-16T13:01:23+00:00,,report_verification,,"52.4940764585321,13.4151195032175"
558,"Fidicinstraße 29, 10965 Berlin","Es gibt einen Schülerladen, Kuta und Laden und Büro gegenüber.",4,False,2019-09-16T14:50:17+00:00,,report_verification,,"52.4867918755311,13.3924789271097"
559,"Kottbusser Damm 1, 10967 Berlin","Enormer Bedarf vor dem Netto. Drei KFZ-Stellflächen, aktuell belegt von einem dauerparkenden Anhänger, stehen als Fläche bereit. Bei Bedarf Kurzzeit,- oder Kieferparkplatz gegenüber möglich.",12,False,2019-09-16T15:59:49+00:00,,report_accepted,,"52.4953875917444,13.4201347184448"
560,"Graefestraße 1, 10967 Berlin",Bügel vor dem Fuchsbau dauerhaft überlastet. Flächen stehen davor auf drei Parkplätzen zur Verfügung. Ggf. Liefer- oder Kurzzeitparkplatz gegenüber möglich.,10,False,2019-09-16T16:03:08+00:00,,report_accepted,,"52.4955325118799,13.4196396134455"
561,"Kommandantenstraße 23, 10969 Berlin",Kreuzung,4,False,2019-09-16T16:40:07+00:00,,report_verification,,"52.5076583283009,13.404478875827"
562,"Friedrichstraße 21, 10969 Berlin","tägl. ca. 20 Räder am Zaun entlang Besselpark, Platzierung Bügel idealerweise Einmündung Feuerwehrzufahrt Friedrichstrasse 23a/Besselpark anstelle Parkplätze auf der Friedrichstraße.",10,False,2019-09-16T16:42:24+00:00,,report_verification,,"52.5034081469413,13.3912071879222"
563,"Friedrichstraße 21, 10969 Berlin",Statt 6 PKW Stellplätzen direkt vor taz-Gebäude Einrichtung Lieferzone an Gehwegvorstreckung für Belieferung taz (LKW parken täglich in 2. Reihe und beliefern über Gehwegvorstreckung) + Radbügel (aktuell täglich 15-20 Räder auf Gehweg an Stahlkon,10,False,2019-09-16T16:47:39+00:00,,report_verification,,"52.503168841766,13.3911921254219"
564,"E.T.a.-Hoffmann-Promenade, 10969 Berlin","E.T.A.-Hoffmann-Promenade ist Feuerwehrzufahrt zur Galilei-Grundschule und wird täglich von 10-20 Autos zugeparkt. Entlang Gebäude der Ärztekammer (Friedrichstr. 16) wurden bereits Bügel installiert, weitere in der Promenade wären gut – Alternativ",12,False,2019-09-16T16:56:33+00:00,,report_verification,,"52.5022456118391,13.3932049291177"
565,"Frankfurter Allee 48, 10247 Berlin","Fahrräder werden bisher einfach auf dem Fußweg direkt an den Ampel abgestellt, so es keine Fahrradbügel gibt. Quasi als Park und ride weil es zu U-Bahn geht. Dies versperrt den Weg für Fußgänger.",5,True,2019-09-16T17:15:11+00:00,,report_verification,,"52.5145371821063,13.4641695753846"
566,"Matthiasstraße 7, 10249 Berlin","Bügel vor Matthiasstr Nr. 7 anstelle Parkplätze für Besucher Ärztehaus, direkt anschliessend an Gehwegabsenkung (dadurch zusätzlich Verbesserung der Sicht an Gehwegabsenkung für Grundschüler auf Schulweg zur Spartacus Grundschule). Absenkung ist h",8,False,2019-09-16T17:19:48+00:00,,report_verification,,"52.5228131753295,13.4405035534755"
567,"Frankfurter Allee 57, 10247 Berlin",Es fehlen Fahrradbügel vorm netto und den anderen Geschäften sowie beim Zugang zur ubahn Samariterstraße.,10,False,2019-09-16T17:23:00+00:00,,report_verification,,"52.5147551585994,13.4657833715754"
568,"Matthiasstraße 12, 10249 Berlin",Bisher keinerlei Abstellmöglichkeiten für Räder vor Ärztehaus vorhanden. Räder werden kreuz und quer auf schmalem Gehweg abgestellt. Nach Beendigung Baustelle (temporäre Einbahnstrasse+Halteverbot eingerichtet) bitte Bügel + Lastenradstellplätze,10,False,2019-09-16T17:27:37+00:00,,report_verification,,"52.5236347763011,13.4399072164746"
569,"Schreinerstraße 49, 10247 Berlin",Vor dem Drachenspielplatz gibt es zu wenig Fahrradbügel da viele Erwachsene und Kinder mit dem Fahrrad kommen. Die Räder werden bisher deshalb mit auf den Spielplatz genommen statt die davor anzuschließen.,10,False,2019-09-16T17:27:54+00:00,,report_verification,,"52.5171218782228,13.4666445076396"
570,"Marchlewskistraße 42, 10243 Berlin","Vor der Kirche und Netzwerkschule fehlen Fahrradbügel, Marchlewskistr 40.",5,False,2019-09-16T17:31:51+00:00,,report_verification,,"52.5135674145474,13.4445303677194"
571,"Proskauer Straße 29, 10247 Berlin","Die Fahrradständer sollten genau an der Ecke Proskauer Str. Ecke Rigaer Str. angebracht werden auf der Seite wo sich das Pakistanisch-Indische Restaurant befindet da hier immer viele Fahrräder rumstehen.
LG",5,False,2019-09-16T18:56:19+00:00,,report_verification,,"52.5171388250894,13.4610936114914"
572,"Fidicinstraße 24, 10965 Berlin","Vor dem Restaurant Z stehen zu Stoßzeiten viele Fahrräder, die an Pfosten angeschlossen werden und für Fußgänger die Straßenquerung blockieren",3,False,2019-09-16T19:27:58+00:00,,report_verification,,"52.4865910220482,13.3941336702201"
573,"Schwiebusser Straße 46, 10965 Berlin","Vor dem Restaurant Castel Montecroce werden zu Stoßzeiten viele Fahrräder auf dem Bürgersteig abgestellt, der hier eh schon sehr schmal ist",4,False,2019-09-16T19:31:41+00:00,,report_verification,,"52.485829300707,13.3942683773839"
574,"a 100, 10245 Berlin",Katastrophe,12,False,2019-09-16T19:37:21+00:00,,report_verification,,"52.5039891035523,13.4675871780142"
575,"Fidicinstraße 6, 10965 Berlin",Die Fußgängerfurt und der Bürgersteig ist häufig mit Fahrrädern blockiert.,5,False,2019-09-16T19:37:32+00:00,,report_verification,,"52.4871014774556,13.3891085299592"
576,"Fidicinstraße 44, 10965 Berlin",Die Fußgängerfurt ist oft mit Fahrrädern zugestellt.,3,False,2019-09-16T19:39:49+00:00,,report_verification,,"52.4872404237486,13.387020155136"
577,"Mehringdamm 60, 10961 Berlin",Der Radweg auf dem Mehringdamm stadtauswärts ist sehr schmal und v.a. zwischen Landwehrkanal und Kreuzbergstraße durch parkende Fahrräder zusätzlich eingeengt.,11,False,2019-09-16T19:44:43+00:00,,report_verification,,"52.4910481360404,13.3865239264105"
578,"Ebertystraße 54, 10249 Berlin","Keine Abstellmöglichkeiten vor Kinderspielplatz, Querung der Strassen kaum möglich, da keine Bordsteinabsenkung und lückenlos zugeparkt. Bitte Fahrradbügel mit Lücke für Querung und bessere Sicht (insbesondere für Kinder).",6,False,2019-09-16T20:16:33+00:00,,report_verification,,"52.5267016461175,13.4511693868785"
579,"Urbanstraße 83, 10967 Berlin","Vor Karstadt/Sparkasse stehen immer extrem viele Fahrräder und der Bürgersteig ist sehr schmal, zudem ist dort eine Bushaltestelle, die von Fahrrädern auf dem Bürgersteig blockiert wird.",10,True,2019-09-16T20:49:00+00:00,,report_verification,,"52.4880507280591,13.4243494224129"
580,"Hornstraße 8, 10963 Berlin",Vor einer Kirche sollten stets Fahrradbügel stehen! Besten Dank.,8,False,2019-09-17T07:10:36+00:00,,report_verification,,"52.4944116191156,13.3815366189325"
581,"Wartenburgstraße 6, 10963 Berlin","Hier sind neben intensiver Wohnbebauung zwei Kindergärten und ein Gemeindehaus und es gibt viel zu wenige Möglichkeiten zum Abstellen und Anschließen von Fahrrädern. Man kann die Abstellanlagen zwar auf dem Bürgersteig einrichten, aber auch Autopark",8,False,2019-09-17T07:13:31+00:00,,report_verification,,"52.4956128937184,13.3811572799126"
582,"Forster Straße 36, 10999 Berlin","An dieser Stelle befindet sich der Boule-Platz am Paul-Lincke-Ufer. Viele Personen kommen mit Rad dort hin. Deswegen wären hier Radbügel sehr sinnvoll!!

Der genaue Ort der Bügel sollte durch Ihre Expertise bestimmt werden. Wichtig ist die Nähe zum B",8,False,2019-09-17T09:36:29+00:00,,report_verification,,"52.4928545664907,13.4319967523008"
583,"Spielplatz Dreiländereck, Ratiborstr., Berlin, 10999","Am Dreiländereck direkt an der Wiese wären einige Fahrradbügel sehr hilfreich. Dort befindet sich zwar keine Straße, jedoch könnten Fahrradbügel zwischen dem Spielplatz und der ""Liegewiese"" installiert werden.",4,False,2019-09-17T09:39:12+00:00,,report_verification,,"52.4913874361085,13.4397946313045"
584,"Antiquariat Kalligramm, Berlin, 10999",Auf der gesamten Oranienstraße fehlt es an Fahrradbügeln,8,False,2019-09-17T11:33:34+00:00,,report_verification,,"52.5012308937807,13.4193199386197"
585,"Spielplatz Görlitzer Park, Wiener Str., Berlin, 10999","Auf diesem Spielplatz mit großer Rutsche und Barfußspielplatz gibt es leider gar keine Möglichkeit sein Fahrrad sicher abzustellen, wenn man nicht die ganze Zeit daneben stehen bleiben kann.",4,False,2019-09-17T12:29:14+00:00,,report_verification,,"52.4947424921127,13.4421197913466"
586,"Lausitzer Straße 9, 10999 Berlin","Die Lausitzer Str. zwischen Wiener Str. und Reichenberger Str. insgesamt benötigt sichere Fahrradbügel. Hier können Räder bisher nur an den wenigen Laternen angeschlossen werden, wodurch der ohnehin schmale Fußweg regelmäßig vollgestellt wird.",4,False,2019-09-17T12:31:56+00:00,,report_verification,,"52.4974084978351,13.4288119566927"
587,"Glogauer Straße 15, 10999 Berlin",Vor der Familienbibliothek gibt es leider gar keine Möglichkeit ein Fahrrad (vor allem mit Kindersitz) sicher abzustellen. Auch zwei Stellplätze für Lastenräder werden benötigt.,5,False,2019-09-17T12:36:26+00:00,,report_verification,,"52.4925268005501,13.4364799005692"
